{
 "a_id_order_sha256": "2cd62042ddf2e3179f5bb76dbf9fb5d1feecd6110398bcb2f273dd7424853ba4",
 "columns": [
  "v1",
  "v2",
  "n_candidates",
  "labelled",
  "top1_correct",
  "truth_reachable"
 ],
 "completeness": {
  "a_records_expected": 96557,
  "a_records_in_file": 96557,
  "conserved": true,
  "labelled": 48372,
  "labelled_reachable": 46625,
  "with_candidates": 73216,
  "without_candidates": 23341
 },
 "decision_value_kind": "uncalibrated_score",
 "file": "replay_rules_v1.test.csv.gz",
 "floor_sweep_reconciliation": {
  "all_equal": true,
  "points_compared": 12
 },
 "inputs": [
  {
   "manifest_key": "artifacts/manifest.json#pairs.features.file_sha256",
   "path": "data/pairs/features.parquet",
   "role": "local_features",
   "sha256": "8b6fc8b4c1e5c89513f225f8a402e0f90f20cb9c740f74361903d4b8dc0d2ddf"
  },
  {
   "manifest_key": "artifacts/manifest.json#pairs.candidates.file_sha256",
   "path": "data/pairs/candidates.parquet",
   "role": "local_candidates",
   "sha256": "9c28aca92832faa812b1b40baf9d6357016b709de381eab216198c0759ca0f9a"
  },
  {
   "manifest_key": "artifacts/manifest.json#sample.files.truth.file_sha256",
   "path": "data/sample/truth.parquet",
   "role": "local_truth",
   "sha256": "c9955915080ad1eea0691f6924b12f1910da16be36dff35711ca59b78da7e58f"
  },
  {
   "manifest_key": "artifacts/manifest.json#sample.files.a.file_sha256",
   "path": "data/sample/a.parquet",
   "role": "local_sample_a",
   "sha256": "f8ed6458dac83a6d24d2349b9b5cea536ea1da328ae324a5e9a92dae406ed83a"
  }
 ],
 "lab_replay_version": "1.0",
 "legacy_sweep_divergence": {
  "max_accepts_difference": 7393,
  "note": "The legacy sweep (review_sensitivity.json#points) computed the ambiguity-demotion flag once at the recorded accept threshold and reused it at every swept threshold. Below the recorded accept_min a record with a top-2 gap under ambiguity_gap and a value between the threshold and accept_min is accepted by the legacy calculation but must be review under a faithful replay; at or above the recorded accept_min the two coincide. legacy_matches_artifact confirms the restated legacy calculation reproduces the committed points; the corrected columns are the full replay.",
  "points": [
   {
    "corrected_accepts": 51872,
    "corrected_review_queue": 21344,
    "legacy_accepts": 59265,
    "legacy_matches_artifact": true,
    "legacy_review_queue": 13951,
    "threshold": 0.5
   },
   {
    "corrected_accepts": 51655,
    "corrected_review_queue": 21561,
    "legacy_accepts": 58773,
    "legacy_matches_artifact": true,
    "legacy_review_queue": 14443,
    "threshold": 0.51
   },
   {
    "corrected_accepts": 51426,
    "corrected_review_queue": 21790,
    "legacy_accepts": 58248,
    "legacy_matches_artifact": true,
    "legacy_review_queue": 14968,
    "threshold": 0.52
   },
   {
    "corrected_accepts": 51128,
    "corrected_review_queue": 22088,
    "legacy_accepts": 57591,
    "legacy_matches_artifact": true,
    "legacy_review_queue": 15625,
    "threshold": 0.53
   },
   {
    "corrected_accepts": 50824,
    "corrected_review_queue": 22392,
    "legacy_accepts": 56842,
    "legacy_matches_artifact": true,
    "legacy_review_queue": 16374,
    "threshold": 0.54
   },
   {
    "corrected_accepts": 50472,
    "corrected_review_queue": 22744,
    "legacy_accepts": 55955,
    "legacy_matches_artifact": true,
    "legacy_review_queue": 17261,
    "threshold": 0.55
   },
   {
    "corrected_accepts": 50134,
    "corrected_review_queue": 23082,
    "legacy_accepts": 55132,
    "legacy_matches_artifact": true,
    "legacy_review_queue": 18084,
    "threshold": 0.56
   },
   {
    "corrected_accepts": 49829,
    "corrected_review_queue": 23387,
    "legacy_accepts": 54215,
    "legacy_matches_artifact": true,
    "legacy_review_queue": 19001,
    "threshold": 0.57
   },
   {
    "corrected_accepts": 49525,
    "corrected_review_queue": 23691,
    "legacy_accepts": 53230,
    "legacy_matches_artifact": true,
    "legacy_review_queue": 19986,
    "threshold": 0.58
   },
   {
    "corrected_accepts": 49269,
    "corrected_review_queue": 23947,
    "legacy_accepts": 52444,
    "legacy_matches_artifact": true,
    "legacy_review_queue": 20772,
    "threshold": 0.59
   },
   {
    "corrected_accepts": 48994,
    "corrected_review_queue": 24222,
    "legacy_accepts": 51431,
    "legacy_matches_artifact": true,
    "legacy_review_queue": 21785,
    "threshold": 0.6
   },
   {
    "corrected_accepts": 48805,
    "corrected_review_queue": 24411,
    "legacy_accepts": 50652,
    "legacy_matches_artifact": true,
    "legacy_review_queue": 22564,
    "threshold": 0.61
   },
   {
    "corrected_accepts": 48639,
    "corrected_review_queue": 24577,
    "legacy_accepts": 50008,
    "legacy_matches_artifact": true,
    "legacy_review_queue": 23208,
    "threshold": 0.62
   },
   {
    "corrected_accepts": 48492,
    "corrected_review_queue": 24724,
    "legacy_accepts": 49407,
    "legacy_matches_artifact": true,
    "legacy_review_queue": 23809,
    "threshold": 0.63
   },
   {
    "corrected_accepts": 48325,
    "corrected_review_queue": 24891,
    "legacy_accepts": 48825,
    "legacy_matches_artifact": true,
    "legacy_review_queue": 24391,
    "threshold": 0.64
   },
   {
    "corrected_accepts": 48140,
    "corrected_review_queue": 25076,
    "legacy_accepts": 48140,
    "legacy_matches_artifact": true,
    "legacy_review_queue": 25076,
    "threshold": 0.65
   },
   {
    "corrected_accepts": 47585,
    "corrected_review_queue": 25631,
    "legacy_accepts": 47585,
    "legacy_matches_artifact": true,
    "legacy_review_queue": 25631,
    "threshold": 0.66
   },
   {
    "corrected_accepts": 47384,
    "corrected_review_queue": 25832,
    "legacy_accepts": 47384,
    "legacy_matches_artifact": true,
    "legacy_review_queue": 25832,
    "threshold": 0.67
   },
   {
    "corrected_accepts": 47202,
    "corrected_review_queue": 26014,
    "legacy_accepts": 47202,
    "legacy_matches_artifact": true,
    "legacy_review_queue": 26014,
    "threshold": 0.68
   },
   {
    "corrected_accepts": 46970,
    "corrected_review_queue": 26246,
    "legacy_accepts": 46970,
    "legacy_matches_artifact": true,
    "legacy_review_queue": 26246,
    "threshold": 0.69
   },
   {
    "corrected_accepts": 46728,
    "corrected_review_queue": 26488,
    "legacy_accepts": 46728,
    "legacy_matches_artifact": true,
    "legacy_review_queue": 26488,
    "threshold": 0.7
   },
   {
    "corrected_accepts": 46564,
    "corrected_review_queue": 26652,
    "legacy_accepts": 46564,
    "legacy_matches_artifact": true,
    "legacy_review_queue": 26652,
    "threshold": 0.71
   },
   {
    "corrected_accepts": 46350,
    "corrected_review_queue": 26866,
    "legacy_accepts": 46350,
    "legacy_matches_artifact": true,
    "legacy_review_queue": 26866,
    "threshold": 0.72
   },
   {
    "corrected_accepts": 46151,
    "corrected_review_queue": 27065,
    "legacy_accepts": 46151,
    "legacy_matches_artifact": true,
    "legacy_review_queue": 27065,
    "threshold": 0.73
   },
   {
    "corrected_accepts": 45933,
    "corrected_review_queue": 27283,
    "legacy_accepts": 45933,
    "legacy_matches_artifact": true,
    "legacy_review_queue": 27283,
    "threshold": 0.74
   },
   {
    "corrected_accepts": 45687,
    "corrected_review_queue": 27529,
    "legacy_accepts": 45687,
    "legacy_matches_artifact": true,
    "legacy_review_queue": 27529,
    "threshold": 0.75
   },
   {
    "corrected_accepts": 45555,
    "corrected_review_queue": 27661,
    "legacy_accepts": 45555,
    "legacy_matches_artifact": true,
    "legacy_review_queue": 27661,
    "threshold": 0.76
   },
   {
    "corrected_accepts": 45391,
    "corrected_review_queue": 27825,
    "legacy_accepts": 45391,
    "legacy_matches_artifact": true,
    "legacy_review_queue": 27825,
    "threshold": 0.77
   },
   {
    "corrected_accepts": 45205,
    "corrected_review_queue": 28011,
    "legacy_accepts": 45205,
    "legacy_matches_artifact": true,
    "legacy_review_queue": 28011,
    "threshold": 0.78
   },
   {
    "corrected_accepts": 45071,
    "corrected_review_queue": 28145,
    "legacy_accepts": 45071,
    "legacy_matches_artifact": true,
    "legacy_review_queue": 28145,
    "threshold": 0.79
   },
   {
    "corrected_accepts": 44959,
    "corrected_review_queue": 28257,
    "legacy_accepts": 44959,
    "legacy_matches_artifact": true,
    "legacy_review_queue": 28257,
    "threshold": 0.8
   },
   {
    "corrected_accepts": 43220,
    "corrected_review_queue": 29996,
    "legacy_accepts": 43220,
    "legacy_matches_artifact": true,
    "legacy_review_queue": 29996,
    "threshold": 0.81
   },
   {
    "corrected_accepts": 43148,
    "corrected_review_queue": 30068,
    "legacy_accepts": 43148,
    "legacy_matches_artifact": true,
    "legacy_review_queue": 30068,
    "threshold": 0.82
   },
   {
    "corrected_accepts": 43068,
    "corrected_review_queue": 30148,
    "legacy_accepts": 43068,
    "legacy_matches_artifact": true,
    "legacy_review_queue": 30148,
    "threshold": 0.83
   },
   {
    "corrected_accepts": 42988,
    "corrected_review_queue": 30228,
    "legacy_accepts": 42988,
    "legacy_matches_artifact": true,
    "legacy_review_queue": 30228,
    "threshold": 0.84
   },
   {
    "corrected_accepts": 42897,
    "corrected_review_queue": 30319,
    "legacy_accepts": 42897,
    "legacy_matches_artifact": true,
    "legacy_review_queue": 30319,
    "threshold": 0.85
   },
   {
    "corrected_accepts": 42213,
    "corrected_review_queue": 31003,
    "legacy_accepts": 42213,
    "legacy_matches_artifact": true,
    "legacy_review_queue": 31003,
    "threshold": 0.86
   },
   {
    "corrected_accepts": 42130,
    "corrected_review_queue": 31086,
    "legacy_accepts": 42130,
    "legacy_matches_artifact": true,
    "legacy_review_queue": 31086,
    "threshold": 0.87
   },
   {
    "corrected_accepts": 42056,
    "corrected_review_queue": 31160,
    "legacy_accepts": 42056,